{
  "deal_id": "deal_bracken",
  "files": [
    {
      "checksum": "42833f144a66f3b484da86488ca8e8172b6878e374c9cd584d934933d61e6a94",
      "doc_type": "XLSX",
      "file_id": "file_0032_01",
      "filename": "file_0032_01.xlsx",
      "pages_or_sheets": 10,
      "source_id": "src_0033",
      "storage_uri": "s3://patricius-proxy-sources/src_0033.xlsx"
    },
    {
      "checksum": "e0b3dc6a87e8340c4f7f37bf6f02f18957426c029bef5b7615569ff3bfe28d2f",
      "doc_type": "PDF",
      "file_id": "file_0032_02",
      "filename": "file_0032_02.pdf",
      "pages_or_sheets": 10,
      "source_id": "src_0034",
      "storage_uri": "s3://patricius-proxy-sources/src_0034.pdf"
    },
    {
      "checksum": "f6ddb9e4344b489bfeb86ec4cd3fff786d24d69a30d4ae448bd63efa3637c255",
      "doc_type": "XLSX",
      "file_id": "file_0032_03",
      "filename": "file_0032_03.xlsx",
      "pages_or_sheets": 10,
      "source_id": "src_0035",
      "storage_uri": "s3://patricius-proxy-sources/src_0035.xlsx"
    },
    {
      "checksum": "adcf4c6c9477296b62669ccdcc3b7f54ddde2227c7de8c35403fa2293c4210ac",
      "doc_type": "PDF",
      "file_id": "file_0032_04",
      "filename": "file_0032_04.pdf",
      "pages_or_sheets": 10,
      "source_id": "src_0036",
      "storage_uri": "s3://patricius-proxy-sources/src_0036.pdf"
    }
  ],
  "labeling_workflow": {
    "adjudication_status": "not_required",
    "primary_labeler_status": "completed",
    "reviewer_status": "completed"
  },
  "notes": "Scaled proxy package metadata.",
  "package_id": "pkg_0032",
  "period_end_date": "2026-03-30",
  "quality_flags": [],
  "received_at": "2026-03-06T16:49:05.569282+00:00",
  "schema_version": "1.0",
  "source_email_id": "email_0032",
  "source_ids": [
    "src_0033",
    "src_0034",
    "src_0035",
    "src_0036"
  ],
  "variant_tags": [
    "scaled",
    "follow_up"
  ]
}
