{
  "deal_id": "deal_bracken",
  "files": [
    {
      "checksum": "328904595c1555d430ac023f540b17b23357f9d4665aea59cacb133a4da9ced8",
      "doc_type": "PDF",
      "file_id": "file_0004_01",
      "filename": "file_0004_01.pdf",
      "pages_or_sheets": 12,
      "source_id": "src_0010",
      "storage_uri": "s3://patricius-proxy-sources/src_0010.pdf"
    },
    {
      "checksum": "3075e24e6d5a5293c4265f55f9d4a8c709bcee33fac6c9e3b3235fbaf35076cd",
      "doc_type": "XLSX",
      "file_id": "file_0004_02",
      "filename": "file_0004_02.xlsx",
      "pages_or_sheets": 5,
      "source_id": "src_0011",
      "storage_uri": "s3://patricius-proxy-sources/src_0011.xlsx"
    }
  ],
  "labeling_workflow": {
    "adjudication_status": "not_required",
    "primary_labeler_status": "completed",
    "reviewer_status": "completed"
  },
  "notes": "Proxy package built from public-source metadata.",
  "package_id": "pkg_0004",
  "period_end_date": "2025-12-31",
  "quality_flags": [],
  "received_at": "2026-03-06T16:17:28.439691+00:00",
  "schema_version": "1.0",
  "source_email_id": "email_0004",
  "source_ids": [
    "src_0010",
    "src_0011"
  ],
  "variant_tags": [
    "pilot",
    "follow_up"
  ]
}
