{
  "deal_id": "deal_ember",
  "files": [
    {
      "checksum": "68d82115cb72488063ad0b20792a453339803ca037947da8b421bcff9a344327",
      "doc_type": "XLSX",
      "file_id": "file_0009_01",
      "filename": "file_0009_01.xlsx",
      "pages_or_sheets": 5,
      "source_id": "src_0025",
      "storage_uri": "s3://patricius-proxy-sources/src_0025.xlsx"
    },
    {
      "checksum": "12ff229130f32023562f583f3885de919f40efd7e66f70a6d1474f05f79b3062",
      "doc_type": "PDF",
      "file_id": "file_0009_02",
      "filename": "file_0009_02.pdf",
      "pages_or_sheets": 12,
      "source_id": "src_0026",
      "storage_uri": "s3://patricius-proxy-sources/src_0026.pdf"
    },
    {
      "checksum": "baaeba62fb3c902e63bb39c8ac91c45fed208a6c7eed50ddfef72e7896e90ce3",
      "doc_type": "XLSX",
      "file_id": "file_0009_03",
      "filename": "file_0009_03.xlsx",
      "pages_or_sheets": 5,
      "source_id": "src_0027",
      "storage_uri": "s3://patricius-proxy-sources/src_0027.xlsx"
    },
    {
      "checksum": "d0debf2fac9007148b4d7138e6dac8ad3799a8079b583c67ea668a46ba7fc576",
      "doc_type": "PDF",
      "file_id": "file_0009_04",
      "filename": "file_0009_04.pdf",
      "pages_or_sheets": 12,
      "source_id": "src_0028",
      "storage_uri": "s3://patricius-proxy-sources/src_0028.pdf"
    }
  ],
  "labeling_workflow": {
    "adjudication_status": "not_required",
    "primary_labeler_status": "completed",
    "reviewer_status": "completed"
  },
  "notes": "Proxy package built from public-source metadata.",
  "package_id": "pkg_0009",
  "period_end_date": "2025-09-30",
  "quality_flags": [],
  "received_at": "2026-03-06T16:22:28.439691+00:00",
  "schema_version": "1.0",
  "source_email_id": "email_0009",
  "source_ids": [
    "src_0025",
    "src_0026",
    "src_0027",
    "src_0028"
  ],
  "variant_tags": [
    "pilot",
    "baseline"
  ]
}
