{
  "deal_id": "deal_scale_006",
  "files": [
    {
      "checksum": "c1bc310a69948b4dde28d1030193f376c2b250c489b336d545e4624c7a315d90",
      "doc_type": "XLSX",
      "file_id": "file_0036_01",
      "filename": "file_0036_01.xlsx",
      "pages_or_sheets": 10,
      "source_id": "src_0037",
      "storage_uri": "s3://patricius-proxy-sources/src_0037.xlsx"
    },
    {
      "checksum": "036f04c3286a726a2f0c0990e1405f4e0e7fc5259b7b17c33367df5ddac0db94",
      "doc_type": "PDF",
      "file_id": "file_0036_02",
      "filename": "file_0036_02.pdf",
      "pages_or_sheets": 10,
      "source_id": "src_0038",
      "storage_uri": "s3://patricius-proxy-sources/src_0038.pdf"
    }
  ],
  "labeling_workflow": {
    "adjudication_status": "not_required",
    "primary_labeler_status": "completed",
    "reviewer_status": "completed"
  },
  "notes": "Scaled proxy package metadata.",
  "package_id": "pkg_0036",
  "period_end_date": "2026-03-30",
  "quality_flags": [],
  "received_at": "2026-03-06T16:53:05.569282+00:00",
  "schema_version": "1.0",
  "source_email_id": "email_0036",
  "source_ids": [
    "src_0037",
    "src_0038"
  ],
  "variant_tags": [
    "scaled",
    "follow_up"
  ]
}
