{
  "deal_id": "deal_alderon",
  "files": [
    {
      "checksum": "2196c5cefe38bdb634f122b04fa3b26a153d323cfe59078ed634033ce588cda4",
      "doc_type": "PDF",
      "file_id": "file_0002_01",
      "filename": "file_0002_01.pdf",
      "pages_or_sheets": 12,
      "source_id": "src_0004",
      "storage_uri": "s3://patricius-proxy-sources/src_0004.pdf"
    },
    {
      "checksum": "5d9006b826058e8464e56dcf374639ae969e9941c281b3899290a9fe277fb6c5",
      "doc_type": "XLSX",
      "file_id": "file_0002_02",
      "filename": "file_0002_02.xlsx",
      "pages_or_sheets": 5,
      "source_id": "src_0005",
      "storage_uri": "s3://patricius-proxy-sources/src_0005.xlsx"
    },
    {
      "checksum": "d857feabb2074f2e31e68154f1b604a40a4e005648849d0e65ea2c55004e5337",
      "doc_type": "PDF",
      "file_id": "file_0002_03",
      "filename": "file_0002_03.pdf",
      "pages_or_sheets": 12,
      "source_id": "src_0006",
      "storage_uri": "s3://patricius-proxy-sources/src_0006.pdf"
    }
  ],
  "labeling_workflow": {
    "adjudication_status": "not_required",
    "primary_labeler_status": "completed",
    "reviewer_status": "completed"
  },
  "notes": "Proxy package built from public-source metadata.",
  "package_id": "pkg_0002",
  "period_end_date": "2025-12-31",
  "quality_flags": [],
  "received_at": "2026-03-06T16:15:28.439691+00:00",
  "schema_version": "1.0",
  "source_email_id": "email_0002",
  "source_ids": [
    "src_0004",
    "src_0005",
    "src_0006"
  ],
  "variant_tags": [
    "pilot",
    "follow_up"
  ]
}
