{
  "deal_id": "deal_scale_012",
  "files": [
    {
      "checksum": "79583b723d6873d8d028bc4b899317ab9e17b4f58bc869865b2431d068af1773",
      "doc_type": "XLSX",
      "file_id": "file_0024_01",
      "filename": "file_0024_01.xlsx",
      "pages_or_sheets": 9,
      "source_id": "src_0025",
      "storage_uri": "s3://patricius-proxy-sources/src_0025.xlsx"
    },
    {
      "checksum": "4bff4e87043ac38125762d6b0603bc80e9fcc4e34391f9e9eb3c845b110c610f",
      "doc_type": "PDF",
      "file_id": "file_0024_02",
      "filename": "file_0024_02.pdf",
      "ocr_quality": "degraded",
      "pages_or_sheets": 9,
      "source_id": "src_0026",
      "storage_uri": "s3://patricius-proxy-sources/src_0026.pdf"
    }
  ],
  "labeling_workflow": {
    "adjudication_status": "not_required",
    "primary_labeler_status": "completed",
    "reviewer_status": "completed"
  },
  "notes": "Scaled proxy package metadata.",
  "package_id": "pkg_0024_var_ocr_degraded_pdf",
  "period_end_date": "2025-12-31",
  "quality_flags": [],
  "received_at": "2026-03-06T16:41:05.569282+00:00",
  "schema_version": "1.0",
  "source_email_id": "email_0024",
  "source_ids": [
    "src_0025",
    "src_0026"
  ],
  "variant_tags": [
    "follow_up",
    "ocr_degraded_pdf",
    "scaled",
    "synthetic_stress"
  ]
}
