{
  "deal_id": "deal_scale_014",
  "files": [
    {
      "checksum": "e7df0c583e3adf07bd11da0d827337f72616b819b13ec897e73b95c33b94c13d",
      "doc_type": "XLSX",
      "file_id": "file_0044_01",
      "filename": "file_0044_01.xlsx",
      "pages_or_sheets": 10,
      "source_id": "src_0005",
      "storage_uri": "s3://patricius-proxy-sources/src_0005.xlsx"
    },
    {
      "checksum": "50d3d584807b05f1a4bc0eaefe174e658a6a6499b01fd40876b0a4a65064d3e4",
      "doc_type": "PDF",
      "file_id": "file_0044_02",
      "filename": "file_0044_02.pdf",
      "pages_or_sheets": 10,
      "source_id": "src_0006",
      "storage_uri": "s3://patricius-proxy-sources/src_0006.pdf"
    },
    {
      "checksum": "b9ac27d36360b836a25bc4ae7a749de53410ff4a6308ffaf7a9f3174b5ddfcb0",
      "doc_type": "XLSX",
      "file_id": "file_0044_03",
      "filename": "file_0044_03.xlsx",
      "pages_or_sheets": 10,
      "source_id": "src_0007",
      "storage_uri": "s3://patricius-proxy-sources/src_0007.xlsx"
    }
  ],
  "labeling_workflow": {
    "adjudication_status": "not_required",
    "primary_labeler_status": "completed",
    "reviewer_status": "completed"
  },
  "notes": "Scaled proxy package metadata.",
  "package_id": "pkg_0044_var_missing_schedule",
  "period_end_date": "2026-03-30",
  "quality_flags": [],
  "received_at": "2026-03-06T17:01:05.569282+00:00",
  "schema_version": "1.0",
  "source_email_id": "email_0044",
  "source_ids": [
    "src_0005",
    "src_0006",
    "src_0007"
  ],
  "variant_tags": [
    "follow_up",
    "missing_schedule",
    "scaled",
    "synthetic_stress"
  ]
}
