{
  "deal_id": "deal_scale_006",
  "files": [
    {
      "checksum": "7a1ee39ccd76b0b857755320e59a01bb5b9a873b03ce23edb0f52eb9c2e022c3",
      "doc_type": "XLSX",
      "file_id": "file_0012_01",
      "filename": "file_0012_01.xlsx",
      "pages_or_sheets": 9,
      "source_id": "src_0013",
      "storage_uri": "s3://patricius-proxy-sources/src_0013.xlsx"
    }
  ],
  "labeling_workflow": {
    "adjudication_status": "not_required",
    "primary_labeler_status": "completed",
    "reviewer_status": "completed"
  },
  "notes": "Scaled proxy package metadata.",
  "package_id": "pkg_0012_var_missing_schedule",
  "period_end_date": "2025-12-31",
  "quality_flags": [],
  "received_at": "2026-03-06T16:29:05.569282+00:00",
  "schema_version": "1.0",
  "source_email_id": "email_0012",
  "source_ids": [
    "src_0013"
  ],
  "variant_tags": [
    "follow_up",
    "missing_schedule",
    "scaled",
    "synthetic_stress"
  ]
}
