{
  "deal_id": "deal_scale_007",
  "files": [
    {
      "checksum": "cc58c8f52110031fed1875576e8980040dfde0c1836078a50ea7ad580cebb147",
      "doc_type": "PDF",
      "file_id": "file_0037_01",
      "filename": "file_0037_01.pdf",
      "pages_or_sheets": 10,
      "source_id": "src_0038",
      "storage_uri": "s3://patricius-proxy-sources/src_0038.pdf"
    },
    {
      "checksum": "e2bc59d2d5ce58967d8866d94af6a8914606b257e9676732c247a0c5a144f543",
      "doc_type": "XLSX",
      "file_id": "file_0037_02",
      "filename": "file_0037_02.xlsx",
      "pages_or_sheets": 10,
      "source_id": "src_0039",
      "storage_uri": "s3://patricius-proxy-sources/src_0039.xlsx"
    },
    {
      "checksum": "180a2e8ddfed2f8e58db414f7f5c50dcdddeb3ff4ff42453df2b0f0cca54c84d",
      "doc_type": "PDF",
      "file_id": "file_0037_03",
      "filename": "file_0037_03.pdf",
      "pages_or_sheets": 10,
      "source_id": "src_0040",
      "storage_uri": "s3://patricius-proxy-sources/src_0040.pdf"
    }
  ],
  "labeling_workflow": {
    "adjudication_status": "not_required",
    "primary_labeler_status": "completed",
    "reviewer_status": "completed"
  },
  "notes": "Scaled proxy package metadata.",
  "package_id": "pkg_0037",
  "period_end_date": "2026-03-30",
  "quality_flags": [],
  "received_at": "2026-03-06T16:54:05.569282+00:00",
  "schema_version": "1.0",
  "source_email_id": "email_0037",
  "source_ids": [
    "src_0038",
    "src_0039",
    "src_0040"
  ],
  "variant_tags": [
    "scaled",
    "follow_up"
  ]
}
