{
  "deal_id": "deal_scale_011",
  "files": [
    {
      "checksum": "3e5156796e6d3699c049f4d40d8952f48dd5e664c8412b1d297b8e9daa85b428",
      "doc_type": "XLSX",
      "file_id": "file_0022_01",
      "filename": "file_0022_01.xlsx",
      "pages_or_sheets": 9,
      "source_id": "src_0023",
      "storage_uri": "s3://patricius-proxy-sources/src_0023.xlsx"
    },
    {
      "checksum": "8e49806ae4b5419a02627ee5b81653396c163b14d19269e6895497e88b72a09e",
      "doc_type": "PDF",
      "file_id": "file_0022_02",
      "filename": "file_0022_02.pdf",
      "pages_or_sheets": 9,
      "source_id": "src_0024",
      "storage_uri": "s3://patricius-proxy-sources/src_0024.pdf"
    },
    {
      "checksum": "58513f84c852c215824e10052bbc162f39601136b7650a82686844fb1a507ab9",
      "doc_type": "XLSX",
      "file_id": "file_0022_03",
      "filename": "file_0022_03.xlsx",
      "pages_or_sheets": 9,
      "source_id": "src_0025",
      "storage_uri": "s3://patricius-proxy-sources/src_0025.xlsx"
    }
  ],
  "labeling_workflow": {
    "adjudication_status": "not_required",
    "primary_labeler_status": "completed",
    "reviewer_status": "completed"
  },
  "notes": "Scaled proxy package metadata.",
  "package_id": "pkg_0022",
  "period_end_date": "2025-12-31",
  "quality_flags": [],
  "received_at": "2026-03-06T16:39:05.569282+00:00",
  "schema_version": "1.0",
  "source_email_id": "email_0022",
  "source_ids": [
    "src_0023",
    "src_0024",
    "src_0025"
  ],
  "variant_tags": [
    "scaled",
    "follow_up"
  ]
}
