{
  "deal_id": "deal_bracken",
  "files": [
    {
      "checksum": "c5aba19ea4124860733a85cc1bdfabacbb402ec223779f8bcb40b75d4244b492",
      "doc_type": "XLSX",
      "file_id": "file_0003_01",
      "filename": "file_0003_01.xlsx",
      "pages_or_sheets": 5,
      "source_id": "src_0007",
      "storage_uri": "s3://patricius-proxy-sources/src_0007.xlsx"
    },
    {
      "checksum": "f38ac933bcc47829a21b09d84b736ad12cbee40e4e4a08bdf479e6ed750de3c3",
      "doc_type": "PDF",
      "file_id": "file_0003_02",
      "filename": "file_0003_02.pdf",
      "pages_or_sheets": 12,
      "source_id": "src_0008",
      "storage_uri": "s3://patricius-proxy-sources/src_0008.pdf"
    },
    {
      "checksum": "97a2ff873891ff4d98f1bd3eeb9507bffcc3271426dabb9c4a041b64cc95d626",
      "doc_type": "XLSX",
      "file_id": "file_0003_03",
      "filename": "file_0003_03.xlsx",
      "pages_or_sheets": 5,
      "source_id": "src_0009",
      "storage_uri": "s3://patricius-proxy-sources/src_0009.xlsx"
    },
    {
      "checksum": "960c85effe0e41b19aac0d28511fd4ea4d5eb0c4500b6a282dcbe1959862a09a",
      "doc_type": "PDF",
      "file_id": "file_0003_04",
      "filename": "file_0003_04.pdf",
      "pages_or_sheets": 12,
      "source_id": "src_0010",
      "storage_uri": "s3://patricius-proxy-sources/src_0010.pdf"
    }
  ],
  "labeling_workflow": {
    "adjudication_status": "not_required",
    "primary_labeler_status": "completed",
    "reviewer_status": "completed"
  },
  "notes": "Proxy package built from public-source metadata.",
  "package_id": "pkg_0003",
  "period_end_date": "2025-09-30",
  "quality_flags": [],
  "received_at": "2026-03-06T16:16:28.439691+00:00",
  "schema_version": "1.0",
  "source_email_id": "email_0003",
  "source_ids": [
    "src_0007",
    "src_0008",
    "src_0009",
    "src_0010"
  ],
  "variant_tags": [
    "pilot",
    "baseline"
  ]
}
