{
  "deal_id": "deal_coriant",
  "files": [
    {
      "checksum": "e4b13a280cfcdf41530c0aabbd59f6a570be57b3cb0e41781831b22551673727",
      "doc_type": "XLSX",
      "file_id": "file_0005_01",
      "filename": "file_0005_01.xlsx",
      "pages_or_sheets": 5,
      "source_id": "src_0013",
      "storage_uri": "s3://patricius-proxy-sources/src_0013.xlsx"
    },
    {
      "checksum": "7bd0e8f6952d5e1cfbcd6b2f2370b5b371db720e34e0320f856f90fb6d291d98",
      "doc_type": "PDF",
      "file_id": "file_0005_02",
      "filename": "file_0005_02.pdf",
      "pages_or_sheets": 12,
      "source_id": "src_0014",
      "storage_uri": "s3://patricius-proxy-sources/src_0014.pdf"
    },
    {
      "checksum": "d60715940466c882d6d6a7aaa33bc37ac09b2c7e7aa982666ce99ff51c8efc91",
      "doc_type": "XLSX",
      "file_id": "file_0005_03",
      "filename": "file_0005_03.xlsx",
      "pages_or_sheets": 5,
      "source_id": "src_0015",
      "storage_uri": "s3://patricius-proxy-sources/src_0015.xlsx"
    }
  ],
  "labeling_workflow": {
    "adjudication_status": "not_required",
    "primary_labeler_status": "completed",
    "reviewer_status": "completed"
  },
  "notes": "Proxy package built from public-source metadata.",
  "package_id": "pkg_0005",
  "period_end_date": "2025-08-31",
  "quality_flags": [],
  "received_at": "2026-03-06T16:18:28.439691+00:00",
  "schema_version": "1.0",
  "source_email_id": "email_0005",
  "source_ids": [
    "src_0013",
    "src_0014",
    "src_0015"
  ],
  "variant_tags": [
    "pilot",
    "baseline"
  ]
}
