{
  "deal_id": "deal_dunlin",
  "files": [
    {
      "checksum": "edd3028af1a81392eb17d8b2fca5c4c4d1707fce8c60777346d281bc7718d1bf",
      "doc_type": "XLSX",
      "file_id": "file_0034_01",
      "filename": "file_0034_01.xlsx",
      "pages_or_sheets": 10,
      "source_id": "src_0035",
      "storage_uri": "s3://patricius-proxy-sources/src_0035.xlsx"
    },
    {
      "checksum": "c2b9d073924f445f65e71249bfd3ff3bae5a47bddbc24f728702044140f3dea7",
      "doc_type": "PDF",
      "file_id": "file_0034_02",
      "filename": "file_0034_02.pdf",
      "pages_or_sheets": 10,
      "source_id": "src_0036",
      "storage_uri": "s3://patricius-proxy-sources/src_0036.pdf"
    },
    {
      "checksum": "dde93cd8e81c76cb02093b8449815219dc558c6d97bf497d17c1e63703647fea",
      "doc_type": "XLSX",
      "file_id": "file_0034_03",
      "filename": "file_0034_03.xlsx",
      "pages_or_sheets": 10,
      "source_id": "src_0037",
      "storage_uri": "s3://patricius-proxy-sources/src_0037.xlsx"
    }
  ],
  "labeling_workflow": {
    "adjudication_status": "not_required",
    "primary_labeler_status": "completed",
    "reviewer_status": "completed"
  },
  "notes": "Scaled proxy package metadata.",
  "package_id": "pkg_0034",
  "period_end_date": "2026-03-30",
  "quality_flags": [],
  "received_at": "2026-03-06T16:51:05.569282+00:00",
  "schema_version": "1.0",
  "source_email_id": "email_0034",
  "source_ids": [
    "src_0035",
    "src_0036",
    "src_0037"
  ],
  "variant_tags": [
    "scaled",
    "follow_up"
  ]
}
